{
  "default_target_ref": "refs/heads/master",
  "description": "Safely install and connect Hub, Superpowers and Caveman ultra; verify preservation and actual loading.",
  "id": "plan_antigravity_auto_setup",
  "lifecycle": "active",
  "schema_version": 1,
  "spec_refs": [],
  "tasks": {
    "task_antigravity_install": {
      "acceptance_criteria": [
        "Instalace a aktualizace zachovají uživatelské instrukce a existující skilly",
        "Globální pravidla explicitně aktivují dostupné skilly a Hub",
        "Testy ověří čistou instalaci a opakování",
        "Upřesnění z chatu se promítne do globálního i projektového AGENTS.md: explicitní Local AI Hub, Superpowers a Caveman ultra; respektovat příkazy normal mode a stop caveman."
      ],
      "accountable_role": "Codex",
      "blocker": "Antigravity UI shows baseline model quota reached until 2026-10-30 22:59:42; do not enable paid overages. Therefore real-agent instruction loading/Hub MCP behavior is unverified. Original task_f8d00ca6fd25 is not found by Hub (terminal 404) and its source worktree is absent; do not create duplicate or rebind to another root.",
      "clarifications": [
        {
          "adoption": "adopted",
          "id": "change_dc766e6488a241907c83_9de834fe7915c51c2d639fadebefeef9_r2",
          "spec_refs": [
            {
              "path": "docs/superpowers/specs/2026-10-28-antigravity-auto-activation.md",
              "revision": {
                "content_sha256": "1f0625bad79e3370ee3a9354c4790cb1b554f402c131166436123d3955082624",
                "kind": "working"
              }
            }
          ],
          "summary": "Operator steering steering_antigravity_agents_20261028",
          "supersedes": []
        }
      ],
      "depends_on": [],
      "description": "Integrated in master at 3802e55e (ancestor of current HEAD). Global and project activation rules and required Gemini skill directories are present. Fresh targeted acceptance suite: 46 passed. Antigravity launched and opened .local-ai-hub, but model use is blocked by the visible baseline quota notice; neither instructions being loaded nor a real Hub MCP call was demonstrated.",
      "kind": "code",
      "next_action": "After quota refresh, or with operator-authorized available model access, test a no-file/no-edit Antigravity prompt in the .local-ai-hub project: confirm global/project rules, Superpowers and Caveman ultra activation, normal mode/stop caveman behavior, and one real Hub MCP status call. Then update this existing plan/task with authentic evidence.",
      "title": "Automatic Antigravity setup",
      "work_phase": "verification",
      "work_status": "in_progress"
    }
  },
  "title": "Antigravity automatic setup"
}
