{
  "default_target_ref": "refs/heads/master",
  "description": "Finalize current Local AI Hub 5.1.0 candidate. Resolve hosted CI; verify clean release/wheel evidence; prove installed runtime source and safe live reload; repair and verify project-plan MCP/dashboard workflow; preserve unrelated user data. Close only after exact candidate is pushed and live checks reflect it.",
  "id": "plan_lah_5_1_0_release_finalization",
  "lifecycle": "active",
  "schema_version": 1,
  "spec_refs": [],
  "tasks": {
    "task_dashboard-7256b236-c512-4089-945a-afb6afe8a9f9": {
      "acceptance_criteria": [
        "CI matrix passes for exact HEAD",
        "Clean strict release check and isolated wheel smoke pass for exact HEAD",
        "Live Hub process is proven to load exact pushed source after safe restart",
        "Dashboard health and project plan creation/list/task editing verified",
        "No unrelated user work is modified or committed",
        "Plan completion requires authentic task verification and verified integration of every required target"
      ],
      "accountable_role": "Codex",
      "blocker": "Reproduced local_ai_status failure: only telemetry.summary is degraded (250ms probe_timeout); Hub/Ollama are online. In source, any optional dependency timeout sets top-level success/degraded false. Fix keeps the telemetry warning in dependency_status but excludes it from core availability. CI #254 for 6bad6f4 remains in progress. Dashboard project-plan UI and authentic Agent OS receipts remain open.",
      "clarifications": [],
      "depends_on": [],
      "description": "Finish CI and candidate-bound release checks, confirm the installed runtime reflects the pushed source, resolve the dashboard plan-creation defect, and verify the repo-specific Kanban. Preserve unrelated operator files and do not restart the shared Hub while other chats are active.",
      "kind": "code",
      "next_action": "Finish targeted status health regression checks; commit and push the telemetry status classification fix, install exact pushed source, restart Hub once, then verify live status no longer reports overall degraded solely because telemetry.summary timed out. Reconcile CI for exact revision and retain remaining UI/receipt blockers.",
      "title": "Complete 5.1.0 release and live acceptance",
      "work_status": "in_progress"
    }
  },
  "title": "Local AI Hub 5.1.0 release finalization"
}
